{
  "$schema": "http://json-schema.org/draft-07/schema#",
  "$id": "https://bullpen.dev/schemas/allowances.schema.json",
  "title": "Cost allowances ledger",
  "description": "One entry per free-tier allowance a deployed service relies on. Every figure must trace back to a real, current pricing/docs page via source_url.",
  "type": "array",
  "minItems": 1,
  "items": {
    "type": "object",
    "additionalProperties": false,
    "required": ["service", "metric", "allowance", "unit", "source_url", "checked_on"],
    "properties": {
      "service": {
        "type": "string",
        "minLength": 1,
        "description": "Machine-friendly service identifier, e.g. 'vercel-hobby', 'neon', 'aws-lambda'."
      },
      "metric": {
        "type": "string",
        "minLength": 1,
        "description": "Which allowance of the service this entry describes, e.g. 'active_cpu_time', 'storage'. A service can have several entries, one per metric."
      },
      "allowance": {
        "type": "number",
        "description": "The numeric free-tier allowance, in `unit`."
      },
      "unit": {
        "type": "string",
        "minLength": 1,
        "description": "The unit the allowance is measured in, e.g. 'hours/month', 'GB/project'."
      },
      "source_url": {
        "type": "string",
        "pattern": "^https://",
        "description": "The exact pricing/docs page this figure was read from."
      },
      "checked_on": {
        "type": "string",
        "pattern": "^\\d{4}-\\d{2}-\\d{2}$",
        "description": "The date (YYYY-MM-DD) this figure was verified against source_url."
      },
      "note": {
        "type": ["string", "null"],
        "description": "Optional context: caveats, exact wording from the source, or how the figure was derived."
      }
    }
  }
}
