[
  {
    "service": "vercel-hobby",
    "metric": "active_cpu_time",
    "allowance": 4,
    "unit": "hours/month",
    "source_url": "https://vercel.com/docs/limits/fair-use-guidelines",
    "checked_on": "2026-09-25",
    "note": "Fluid compute Active CPU included for the Hobby plan, from the 'Typical monthly usage guidelines' table."
  },
  {
    "service": "vercel-hobby",
    "metric": "provisioned_memory",
    "allowance": 360,
    "unit": "GB-hrs/month",
    "source_url": "https://vercel.com/docs/limits/fair-use-guidelines",
    "checked_on": "2026-09-25",
    "note": "Fluid compute Provisioned Memory included for the Hobby plan."
  },
  {
    "service": "vercel-hobby",
    "metric": "function_memory_max",
    "allowance": 2,
    "unit": "GB per function (1 vCPU)",
    "source_url": "https://vercel.com/docs/functions/limitations",
    "checked_on": "2026-09-25",
    "note": "Default and maximum memory for a Vercel Function on Hobby; there is no separate lower default to configure."
  },
  {
    "service": "vercel-hobby",
    "metric": "function_max_duration",
    "allowance": 300,
    "unit": "seconds (default and maximum)",
    "source_url": "https://vercel.com/docs/functions/limitations",
    "checked_on": "2026-09-25",
    "note": "With Fluid compute (default for new projects), Hobby functions default to and cap at 300s (5 minutes)."
  },
  {
    "service": "vercel-hobby",
    "metric": "function_invocations",
    "allowance": 1000000,
    "unit": "invocations/month",
    "source_url": "https://vercel.com/docs/limits/fair-use-guidelines",
    "checked_on": "2026-09-25",
    "note": null
  },
  {
    "service": "vercel-hobby",
    "metric": "edge_requests",
    "allowance": 1000000,
    "unit": "requests/month",
    "source_url": "https://vercel.com/pricing",
    "checked_on": "2026-09-25",
    "note": "Listed on the marketing pricing page as '1M / month included'; not broken out separately on the fair-use-guidelines table."
  },
  {
    "service": "vercel-hobby",
    "metric": "deployments_per_day",
    "allowance": 100,
    "unit": "deployments/day",
    "source_url": "https://vercel.com/docs/limits",
    "checked_on": "2026-09-25",
    "note": "Also enforced as a rate limit: 100 per day, 100 per hour, 60 per five minutes."
  },
  {
    "service": "vercel-queues",
    "metric": "api_operations",
    "allowance": 1000000,
    "unit": "operations/month",
    "source_url": "https://vercel.com/docs/queues/pricing",
    "checked_on": "2026-09-25",
    "note": "Vercel Queues is in Beta. Send/Receive/Delete/Visibility-change/Notify each count as one operation; messages are metered in 4 KiB chunks."
  },
  {
    "service": "vercel-workflows",
    "metric": "workflow_events",
    "allowance": 50000,
    "unit": "events/month",
    "source_url": "https://vercel.com/docs/workflows/pricing",
    "checked_on": "2026-09-25",
    "note": "Every state transition in a workflow run is persisted as an event; this is the Hobby included allowance."
  },
  {
    "service": "vercel-workflows",
    "metric": "workflow_data_written",
    "allowance": 1,
    "unit": "GB/month",
    "source_url": "https://vercel.com/docs/workflows/pricing",
    "checked_on": "2026-09-25",
    "note": "Table lists '1 GB' with no explicit period; the page's prose says 'Hobby includes monthly allowances for Workflow Events and Workflow Data Written', so this is read as a monthly allowance. Workflow Data Retained is not available on Hobby at all."
  },
  {
    "service": "neon",
    "metric": "storage",
    "allowance": 1,
    "unit": "GB/project",
    "source_url": "https://neon.com/docs/introduction/plans",
    "checked_on": "2026-10-13",
    "note": "Neon Free plan Postgres storage per project (20 GB across all projects). The 2026-09-25 reading was 0.5 GB; the plans page now says 1 GB."
  },
  {
    "service": "neon",
    "metric": "compute",
    "allowance": 100,
    "unit": "CU-hours/project/month",
    "source_url": "https://neon.com/docs/introduction/plans",
    "checked_on": "2026-10-13",
    "note": "Neon Free plan: 100 CU-hours per project per month, enough for a 0.25 CU compute for 400 hours. Computes suspend after 5 minutes of inactivity and this cannot be disabled on Free. Autoscaling goes up to 2 CU."
  },
  {
    "service": "neon",
    "metric": "projects",
    "allowance": 100,
    "unit": "projects",
    "source_url": "https://neon.com/docs/introduction/plans",
    "checked_on": "2026-10-13",
    "note": "Neon Free plan project count. Bullpen uses one project and one database, with a schema and a role per transactional owner (ADR-0012)."
  },
  {
    "service": "neon",
    "metric": "network_transfer",
    "allowance": 5,
    "unit": "GB/project/month",
    "source_url": "https://neon.com/docs/introduction/plans",
    "checked_on": "2026-10-16",
    "note": "Neon Free plan: 5 GB of network transfer per project per month. When it is used up, Neon suspends the compute until the allowance resets. Added on 2026-10-16, the day it was used up: the project's compute was suspended after my contention runs read the full leaderboard (about 1.7 GB per cell). The figure and the page were checked by the project owner on 2026-10-16."
  },
  {
    "service": "upstash-redis",
    "metric": "data_size",
    "allowance": 256,
    "unit": "MB",
    "source_url": "https://upstash.com/docs/redis/overall/pricing",
    "checked_on": "2026-09-25",
    "note": "Max data size on the free tier database."
  },
  {
    "service": "upstash-redis",
    "metric": "monthly_commands",
    "allowance": 500000,
    "unit": "commands/month",
    "source_url": "https://upstash.com/docs/redis/overall/pricing",
    "checked_on": "2026-09-25",
    "note": null
  },
  {
    "service": "upstash-redis",
    "metric": "monthly_bandwidth",
    "allowance": 10,
    "unit": "GB/month",
    "source_url": "https://upstash.com/docs/redis/overall/pricing",
    "checked_on": "2026-09-25",
    "note": null
  },
  {
    "service": "grafana-cloud",
    "metric": "metrics_active_series",
    "allowance": 10000,
    "unit": "active series",
    "source_url": "https://grafana.com/pricing/",
    "checked_on": "2026-09-25",
    "note": "Grafana Cloud Free tier metrics allowance, 14 day retention."
  },
  {
    "service": "grafana-cloud",
    "metric": "logs_ingest",
    "allowance": 50,
    "unit": "GB/month",
    "source_url": "https://grafana.com/pricing/",
    "checked_on": "2026-09-25",
    "note": "14 day retention on the Free tier."
  },
  {
    "service": "grafana-cloud",
    "metric": "traces_ingest",
    "allowance": 50,
    "unit": "GB/month",
    "source_url": "https://grafana.com/pricing/",
    "checked_on": "2026-09-25",
    "note": "14 day retention on the Free tier."
  },
  {
    "service": "aws-lambda",
    "metric": "requests",
    "allowance": 1000000,
    "unit": "requests/month",
    "source_url": "https://aws.amazon.com/free/compute/",
    "checked_on": "2026-09-25",
    "note": "Listed under AWS's 'Always Free' category (perpetual, not the 12-month free trial tier)."
  },
  {
    "service": "aws-lambda",
    "metric": "compute",
    "allowance": 400000,
    "unit": "GB-seconds/month",
    "source_url": "https://aws.amazon.com/free/compute/",
    "checked_on": "2026-09-25",
    "note": "Listed under AWS's 'Always Free' category (perpetual, not the 12-month free trial tier). Equivalent to up to 3.2 million seconds of compute time per month."
  },
  {
    "service": "coingecko-demo",
    "metric": "monthly_calls",
    "allowance": 10000,
    "unit": "calls/month",
    "source_url": "https://www.coingecko.com/en/api/pricing",
    "checked_on": "2026-09-26",
    "note": "Demo plan monthly call credit. See ADR-0005 and docs/data-sources.md. architecture/fitness's budget check keeps modeled monthly usage (from apps/web's actual configured cache interval) at or under 90% of this figure."
  },
  {
    "service": "coingecko-demo",
    "metric": "rate_limit",
    "allowance": 100,
    "unit": "calls/min",
    "source_url": "https://www.coingecko.com/en/api/pricing",
    "checked_on": "2026-09-26",
    "note": "Demo plan rate limit. Not a concern at Bullpen's Part 1 volume (one route, cached for 300s), recorded for completeness."
  },
  {
    "service": "alpha-vantage-free",
    "metric": "daily_calls",
    "allowance": 25,
    "unit": "calls/day",
    "source_url": "https://www.alphavantage.co/premium/",
    "checked_on": "2026-10-13",
    "note": "Free key's daily call limit, end-of-day data only. One symbol per GLOBAL_QUOTE request. The call budget caps Bullpen's own calls at 20 a day (ADR-0008, ADR-0013). A 5-a-minute limit is reported by secondary sources only and is unconfirmed."
  },
  {
    "service": "vercel-services",
    "metric": "service_requests",
    "allowance": 1000000,
    "unit": "requests/month",
    "source_url": "https://vercel.com/docs/services/pricing",
    "checked_on": "2026-10-13",
    "note": "Vercel Services is in Beta. A service request is one call from one service to another over a binding; requests from the public internet are not service requests. Compute is billed like Vercel Functions, so Active CPU and provisioned memory draw on the Hobby allowances above."
  }
]
